[
    {
        "contractVersion": 1,
        "runId": "0199f2a0-7c1e-7a3b-9d4e-5f6a7b8c9d0e",
        "sequence": 1,
        "type": "run.started",
        "data": {}
    },
    {
        "contractVersion": 1,
        "runId": "0199f2a0-7c1e-7a3b-9d4e-5f6a7b8c9d0e",
        "sequence": 2,
        "type": "run.progress",
        "data": { "stage": "answering" }
    },
    {
        "contractVersion": 1,
        "runId": "0199f2a0-7c1e-7a3b-9d4e-5f6a7b8c9d0e",
        "sequence": 3,
        "type": "assistant.delta",
        "data": { "text": "The sample office " }
    },
    {
        "contractVersion": 1,
        "runId": "0199f2a0-7c1e-7a3b-9d4e-5f6a7b8c9d0e",
        "sequence": 4,
        "type": "assistant.delta",
        "data": { "text": "code is SAMPLE-001." }
    },
    {
        "contractVersion": 1,
        "runId": "0199f2a0-7c1e-7a3b-9d4e-5f6a7b8c9d0e",
        "sequence": 5,
        "type": "assistant.final",
        "data": { "text": "The sample office code is SAMPLE-001." }
    },
    {
        "contractVersion": 1,
        "runId": "0199f2a0-7c1e-7a3b-9d4e-5f6a7b8c9d0e",
        "sequence": 6,
        "type": "run.completed",
        "data": {}
    }
]
